{
  "schemaVersion": "OfflineTeacherLabelingV1",
  "revision": 1,
  "status": "FROZEN",
  "encoding": "UTF-8",
  "unitCount": 80,
  "units": [
    {
      "unitId": "kref:ref-lost-opportunity",
      "caseId": "ref-lost-opportunity",
      "sourceHash": "7499fed3fac360f7f880de52bb61ead4bd2001432a3cbf06776c52a693ab8600",
      "teacherVersion": "RVE2_KERNEL",
      "mode": "auto",
      "selected": "fallback",
      "pareto": [
        "fallback",
        "pass-real"
      ],
      "alternatives": [
        "pass-real"
      ],
      "excluded": [
        "lost-fact"
      ],
      "eligible": [
        "fallback",
        "pass-real"
      ],
      "rankByCandidateId": {
        "fallback": 0,
        "pass-real": 1
      },
      "hardExclusionByCandidateId": {
        "lost-fact": true,
        "pass-real": false,
        "fallback": false
      },
      "informationValuePresent": false,
      "labelStatus": "TEACHER_LABELED",
      "notPairableReasons": []
    },
    {
      "unitId": "kref:ref-manual-locked",
      "caseId": "ref-manual-locked",
      "sourceHash": "3b9c01f3f146590c89f73e91f06ef09d735f9f40d38b0f4bf8bc5226620334b9",
      "teacherVersion": "RVE2_KERNEL",
      "mode": "manual",
      "selected": "player-choice",
      "pareto": [
        "ai-preferred",
        "player-choice"
      ],
      "alternatives": [
        "ai-preferred"
      ],
      "excluded": [],
      "eligible": [
        "ai-preferred",
        "player-choice"
      ],
      "rankByCandidateId": {},
      "hardExclusionByCandidateId": {
        "player-choice": false,
        "ai-preferred": false
      },
      "informationValuePresent": false,
      "labelStatus": "MANUAL_LOCKED_AUDIT_ONLY",
      "notPairableReasons": []
    },
    {
      "unitId": "kref:ref-s1-any-all",
      "caseId": "ref-s1-any-all",
      "sourceHash": "dea108c96813c97ab3919efba9e035c502111d7405314d41170aaedd6e79fed9",
      "teacherVersion": "RVE2_KERNEL",
      "mode": "auto",
      "selected": "any-highest",
      "pareto": [
        "any-highest"
      ],
      "alternatives": [],
      "excluded": [],
      "eligible": [
        "all-bottleneck",
        "any-highest"
      ],
      "rankByCandidateId": {
        "all-bottleneck": 2,
        "any-highest": 0
      },
      "hardExclusionByCandidateId": {
        "any-highest": false,
        "all-bottleneck": false
      },
      "informationValuePresent": false,
      "labelStatus": "TEACHER_LABELED",
      "notPairableReasons": []
    },
    {
      "unitId": "kref:ref-s1-first-terminal",
      "caseId": "ref-s1-first-terminal",
      "sourceHash": "9943c6d4db5f8531a8dca1f909a4854d28d4ce845f50b899e23df7b697a20cbd",
      "teacherVersion": "RVE2_KERNEL",
      "mode": "auto",
      "selected": "lethal-first",
      "pareto": [
        "lethal-first",
        "nonlethal-safe"
      ],
      "alternatives": [
        "nonlethal-safe"
      ],
      "excluded": [],
      "eligible": [
        "lethal-first",
        "nonlethal-safe",
        "terminal-draw",
        "terminal-failure"
      ],
      "rankByCandidateId": {
        "lethal-first": 0,
        "nonlethal-safe": 1,
        "terminal-draw": 2,
        "terminal-failure": 2
      },
      "hardExclusionByCandidateId": {
        "lethal-first": false,
        "nonlethal-safe": false,
        "terminal-failure": false,
        "terminal-draw": false
      },
      "informationValuePresent": false,
      "labelStatus": "TEACHER_LABELED",
      "notPairableReasons": []
    },
    {
      "unitId": "kref:ref-s1-threshold-truncation",
      "caseId": "ref-s1-threshold-truncation",
      "sourceHash": "1f760eb5fd284e53adac035b9a63448e5ad1b0b03e95605b09afca7eaddd4647",
      "teacherVersion": "RVE2_KERNEL",
      "mode": "auto",
      "selected": "threshold-attack",
      "pareto": [
        "threshold-attack",
        "threshold-defend"
      ],
      "alternatives": [
        "threshold-defend"
      ],
      "excluded": [],
      "eligible": [
        "threshold-attack",
        "threshold-defend"
      ],
      "rankByCandidateId": {
        "threshold-attack": 0,
        "threshold-defend": 1
      },
      "hardExclusionByCandidateId": {
        "threshold-attack": false,
        "threshold-defend": false
      },
      "informationValuePresent": false,
      "labelStatus": "TEACHER_LABELED",
      "notPairableReasons": []
    },
    {
      "unitId": "kref:ref-s2-opportunity-schedule",
      "caseId": "ref-s2-opportunity-schedule",
      "sourceHash": "752840b4fc6de66e27240ffd218775bd5529b6e2752840a463bc85a52adf85cd",
      "teacherVersion": "RVE2_KERNEL",
      "mode": "auto",
      "selected": "scheduled-control",
      "pareto": [
        "scheduled-control"
      ],
      "alternatives": [],
      "excluded": [],
      "eligible": [
        "direct-hit",
        "scheduled-control"
      ],
      "rankByCandidateId": {
        "direct-hit": 2,
        "scheduled-control": 0
      },
      "hardExclusionByCandidateId": {
        "scheduled-control": false,
        "direct-hit": false
      },
      "informationValuePresent": false,
      "labelStatus": "TEACHER_LABELED",
      "notPairableReasons": []
    },
    {
      "unitId": "kref:ref-s2-pass-lost",
      "caseId": "ref-s2-pass-lost",
      "sourceHash": "e36cd83c2d527594fb78bca33c0db25725143d98c28794be64c80c551dd021c9",
      "teacherVersion": "RVE2_KERNEL",
      "mode": "auto",
      "selected": "legal-attack",
      "pareto": [
        "active-pass",
        "legal-attack"
      ],
      "alternatives": [
        "active-pass"
      ],
      "excluded": [
        "lost-action"
      ],
      "eligible": [
        "active-pass",
        "legal-attack"
      ],
      "rankByCandidateId": {
        "active-pass": 1,
        "legal-attack": 0
      },
      "hardExclusionByCandidateId": {
        "active-pass": false,
        "lost-action": true,
        "legal-attack": false
      },
      "informationValuePresent": false,
      "labelStatus": "TEACHER_LABELED",
      "notPairableReasons": []
    },
    {
      "unitId": "kref:ref-s2-resource-order",
      "caseId": "ref-s2-resource-order",
      "sourceHash": "4bb1340bb6d3db354bc85eaa6ddf099348339145c4bafb8ec0dd0c7abf36cfb2",
      "teacherVersion": "RVE2_KERNEL",
      "mode": "auto",
      "selected": "affordable-response",
      "pareto": [
        "affordable-response"
      ],
      "alternatives": [],
      "excluded": [
        "unaffordable-response"
      ],
      "eligible": [
        "affordable-response"
      ],
      "rankByCandidateId": {
        "affordable-response": 0
      },
      "hardExclusionByCandidateId": {
        "affordable-response": false,
        "unaffordable-response": true
      },
      "informationValuePresent": false,
      "labelStatus": "TEACHER_LABELED",
      "notPairableReasons": []
    },
    {
      "unitId": "kref:ref-s3-control-overlap",
      "caseId": "ref-s3-control-overlap",
      "sourceHash": "9b6328be820d78b27d7a0cbc075691cb9320a9db820ebd6fb2c8ad0f9c0de0da",
      "teacherVersion": "RVE2_KERNEL",
      "mode": "auto",
      "selected": "control-route",
      "pareto": [
        "control-route"
      ],
      "alternatives": [],
      "excluded": [],
      "eligible": [
        "control-route",
        "damage-route"
      ],
      "rankByCandidateId": {
        "control-route": 0,
        "damage-route": 2
      },
      "hardExclusionByCandidateId": {
        "control-route": false,
        "damage-route": false
      },
      "informationValuePresent": false,
      "labelStatus": "TEACHER_LABELED",
      "notPairableReasons": []
    },
    {
      "unitId": "kref:ref-s3-dodge-counter",
      "caseId": "ref-s3-dodge-counter",
      "sourceHash": "ea8d89421c53bcfb63cb9166be7eddff3cf26d4c335b6b9daefda06660bfa172",
      "teacherVersion": "RVE2_KERNEL",
      "mode": "auto",
      "selected": "evade-window",
      "pareto": [
        "evade-window"
      ],
      "alternatives": [],
      "excluded": [],
      "eligible": [
        "counter-shot",
        "evade-window"
      ],
      "rankByCandidateId": {
        "counter-shot": 2,
        "evade-window": 0
      },
      "hardExclusionByCandidateId": {
        "evade-window": false,
        "counter-shot": false
      },
      "informationValuePresent": false,
      "labelStatus": "TEACHER_LABELED",
      "notPairableReasons": []
    },
    {
      "unitId": "kref:ref-s3-protect-critical",
      "caseId": "ref-s3-protect-critical",
      "sourceHash": "615290d3bc4b08ac9b765a026657d4ada9f9c1c29d1d05c50148c0461691f7a6",
      "teacherVersion": "RVE2_KERNEL",
      "mode": "auto",
      "selected": "protect-ally",
      "pareto": [
        "protect-ally"
      ],
      "alternatives": [],
      "excluded": [],
      "eligible": [
        "focus-enemy",
        "protect-ally"
      ],
      "rankByCandidateId": {
        "focus-enemy": 2,
        "protect-ally": 0
      },
      "hardExclusionByCandidateId": {
        "protect-ally": false,
        "focus-enemy": false
      },
      "informationValuePresent": false,
      "labelStatus": "TEACHER_LABELED",
      "notPairableReasons": []
    },
    {
      "unitId": "kref:ref-s4-information-positive",
      "caseId": "ref-s4-information-positive",
      "sourceHash": "672ea8619b3a1ea392dd6a58c02e06e6ff6ca71a3cbb79a6b004bfe2a332f4b4",
      "teacherVersion": "RVE2_KERNEL",
      "mode": "auto",
      "selected": "observe-then-act",
      "pareto": [
        "observe-then-act"
      ],
      "alternatives": [],
      "excluded": [],
      "eligible": [
        "commit-now",
        "observe-then-act"
      ],
      "rankByCandidateId": {
        "commit-now": 2,
        "observe-then-act": 0
      },
      "hardExclusionByCandidateId": {
        "observe-then-act": false,
        "commit-now": false
      },
      "informationValuePresent": true,
      "labelStatus": "TEACHER_LABELED",
      "notPairableReasons": [
        "INFORMATION_FEATURE_MISSING"
      ]
    },
    {